{
  "$schema": "http://json-schema.org/draft-07/schema#",
  "title": "Company research dashboard data",
  "type": "object",
  "properties": {
    "meta": {
      "type": "object",
      "properties": {
        "title": {
          "type": "string",
          "minLength": 1
        },
        "question": {
          "type": "string",
          "minLength": 1
        },
        "asOf": {
          "type": "string",
          "minLength": 1
        },
        "scope": {
          "type": "string",
          "minLength": 1
        },
        "notice": {
          "type": "string",
          "minLength": 1
        },
        "verdictId": {
          "$ref": "#/definitions/id"
        },
        "keyMetricIds": {
          "type": "array",
          "items": {
            "$ref": "#/definitions/id"
          },
          "uniqueItems": true
        }
      },
      "required": [
        "title",
        "question",
        "asOf",
        "scope",
        "notice",
        "verdictId",
        "keyMetricIds"
      ],
      "additionalProperties": false
    },
    "companies": {
      "type": "array",
      "items": {
        "type": "object",
        "properties": {
          "id": {
            "type": "string",
            "minLength": 1,
            "pattern": "^[a-z][a-z0-9-]*$"
          },
          "name": {
            "type": "string",
            "minLength": 1
          },
          "period": {
            "type": "string",
            "minLength": 1
          },
          "case": {
            "$ref": "#/definitions/case"
          }
        },
        "required": [
          "id",
          "name",
          "period"
        ],
        "additionalProperties": false
      },
      "minItems": 1
    },
    "records": {
      "type": "array",
      "items": {
        "$ref": "#/definitions/record"
      },
      "minItems": 1
    },
    "evidence": {
      "type": "array",
      "items": {
        "type": "object",
        "properties": {
          "id": {
            "type": "string",
            "minLength": 1,
            "pattern": "^[a-z][a-z0-9-]*$"
          },
          "title": {
            "type": "string",
            "minLength": 1
          },
          "nature": {
            "type": "string",
            "minLength": 1
          },
          "date": {
            "type": "string",
            "minLength": 1
          },
          "locator": {
            "type": "string",
            "minLength": 1
          },
          "url": {
            "type": [
              "string",
              "null"
            ],
            "pattern": "^https?://"
          },
          "support": {
            "type": "string",
            "minLength": 1
          },
          "limitation": {
            "type": "string",
            "minLength": 1
          }
        },
        "required": [
          "id",
          "title",
          "nature",
          "date",
          "locator",
          "url",
          "support",
          "limitation"
        ],
        "additionalProperties": false
      },
      "minItems": 1
    },
    "sections": {
      "type": "array",
      "items": {
        "$ref": "#/definitions/section"
      },
      "minItems": 6
    }
  },
  "required": [
    "meta",
    "companies",
    "records",
    "evidence",
    "sections"
  ],
  "additionalProperties": false,
  "definitions": {
    "record": {
      "type": "object",
      "properties": {
        "id": {
          "type": "string",
          "minLength": 1,
          "pattern": "^[a-z][a-z0-9-]*$"
        },
        "companyId": {
          "type": [
            "string",
            "null"
          ],
          "pattern": "^[a-z][a-z0-9-]*$"
        },
        "section": {
          "enum": [
            "verdict",
            "assets",
            "paths",
            "choices",
            "validation",
            "questions"
          ]
        },
        "kind": {
          "enum": [
            "fact",
            "inference",
            "recommendation"
          ]
        },
        "role": {
          "enum": [
            "judgment",
            "metric",
            "asset",
            "profile",
            "step",
            "tradeoff",
            "loop",
            "transfer",
            "route",
            "gate",
            "action",
            "contract",
            "question",
            "comparison",
            "proof",
            "meeting",
            "advice"
          ]
        },
        "status": {
          "type": "string",
          "minLength": 1
        },
        "title": {
          "type": "string",
          "minLength": 1
        },
        "text": {
          "type": "string",
          "minLength": 1
        },
        "limitation": {
          "type": "string",
          "minLength": 1
        },
        "evidenceIds": {
          "type": "array",
          "items": {
            "type": "string",
            "minLength": 1,
            "pattern": "^[a-z][a-z0-9-]*$"
          },
          "uniqueItems": true
        },
        "relatedIds": {
          "type": "array",
          "items": {
            "type": "string",
            "minLength": 1,
            "pattern": "^[a-z][a-z0-9-]*$"
          },
          "uniqueItems": true
        },
        "stage": {
          "type": "string",
          "minLength": 1
        },
        "metric": {
          "type": "object",
          "properties": {
            "value": {
              "type": "string",
              "minLength": 1
            },
            "unit": {
              "type": "string",
              "minLength": 1
            },
            "basis": {
              "type": "string",
              "minLength": 1
            }
          },
          "required": [
            "value",
            "unit",
            "basis"
          ],
          "additionalProperties": false
        },
        "fields": {
          "type": "array",
          "items": {
            "type": "object",
            "properties": {
              "label": {
                "type": "string",
                "minLength": 1
              },
              "value": {
                "type": "string",
                "minLength": 1
              },
              "kind": {
                "enum": [
                  "fact",
                  "inference",
                  "recommendation"
                ]
              }
            },
            "required": [
              "label",
              "value"
            ],
            "additionalProperties": false
          },
          "minItems": 1
        },
        "edges": {
          "type": "array",
          "items": {
            "type": "object",
            "properties": {
              "from": {
                "type": "string",
                "minLength": 1
              },
              "to": {
                "type": "string",
                "minLength": 1
              },
              "mechanism": {
                "type": "string",
                "minLength": 1
              },
              "status": {
                "type": "string",
                "minLength": 1
              },
              "evidenceIds": {
                "type": "array",
                "items": {
                  "type": "string",
                  "minLength": 1,
                  "pattern": "^[a-z][a-z0-9-]*$"
                },
                "uniqueItems": true
              }
            },
            "required": [
              "from",
              "to",
              "mechanism",
              "status",
              "evidenceIds"
            ],
            "additionalProperties": false
          },
          "minItems": 1
        },
        "comparisonIds": {
          "type": "array",
          "items": {
            "type": "string",
            "pattern": "^[a-z][a-z0-9-]*$"
          },
          "uniqueItems": true,
          "minItems": 2
        },
        "proof": {
          "type": "object",
          "properties": {
            "proposition": {
              "type": "string",
              "minLength": 1
            },
            "state": {
              "enum": [
                "已证明",
                "有信号",
                "未证明",
                "反证"
              ]
            },
            "evidence": {
              "type": "string",
              "minLength": 1
            },
            "gap": {
              "type": "string",
              "minLength": 1
            },
            "next": {
              "type": "string",
              "minLength": 1
            }
          },
          "required": [
            "proposition",
            "state",
            "evidence",
            "gap",
            "next"
          ],
          "additionalProperties": false
        },
        "meeting": {
          "type": "object",
          "properties": {
            "confirmationType": {
              "enum": [
                "必须确认",
                "信任底线",
                "产品边界",
                "明确删除"
              ]
            },
            "decision": {
              "type": "string",
              "minLength": 1
            },
            "basis": {
              "type": "string",
              "minLength": 1
            },
            "condition": {
              "type": "string",
              "minLength": 1
            },
            "owner": {
              "type": "string",
              "minLength": 1
            },
            "reviewAt": {
              "type": "string",
              "minLength": 1
            }
          },
          "required": [
            "confirmationType",
            "decision",
            "basis",
            "condition",
            "owner",
            "reviewAt"
          ],
          "additionalProperties": false
        },
        "route": {
          "type": "object",
          "properties": {
            "priority": {
              "enum": [
                "当前推荐",
                "第二阶段",
                "暂缓"
              ]
            },
            "condition": {
              "type": "string",
              "minLength": 1
            }
          },
          "required": [
            "priority",
            "condition"
          ],
          "additionalProperties": false
        },
        "adoption": {
          "enum": [
            "立即采用",
            "带条件采用",
            "明确删除",
            "待确认"
          ]
        },
        "milestones": {
          "type": "array",
          "items": {
            "type": "object",
            "properties": {
              "period": {
                "type": "string",
                "minLength": 1
              },
              "action": {
                "type": "string",
                "minLength": 1
              },
              "owner": {
                "type": "string",
                "minLength": 1
              },
              "observe": {
                "type": "string",
                "minLength": 1
              },
              "decision": {
                "type": "string",
                "minLength": 1
              }
            },
            "required": [
              "period",
              "action",
              "owner",
              "observe",
              "decision"
            ],
            "additionalProperties": false
          },
          "minItems": 1
        }
      },
      "required": [
        "id",
        "companyId",
        "section",
        "kind",
        "role",
        "status",
        "title",
        "text",
        "limitation",
        "evidenceIds",
        "relatedIds"
      ],
      "additionalProperties": false,
      "allOf": [
        {
          "if": {
            "properties": {
              "role": {
                "const": "proof"
              }
            }
          },
          "then": {
            "required": [
              "proof"
            ]
          }
        },
        {
          "if": {
            "properties": {
              "role": {
                "const": "meeting"
              }
            }
          },
          "then": {
            "required": [
              "meeting"
            ]
          }
        },
        {
          "if": {
            "properties": {
              "role": {
                "const": "route"
              }
            }
          },
          "then": {
            "required": [
              "route"
            ]
          }
        },
        {
          "if": {
            "properties": {
              "role": {
                "const": "advice"
              }
            }
          },
          "then": {
            "required": [
              "adoption"
            ]
          }
        },
        {
          "if": {
            "properties": {
              "role": {
                "const": "action"
              }
            }
          },
          "then": {
            "required": [
              "milestones"
            ]
          }
        }
      ]
    },
    "id": {
      "type": "string",
      "pattern": "^[a-z][a-z0-9-]*$"
    },
    "section": {
      "type": "object",
      "properties": {
        "id": {
          "$ref": "#/definitions/id"
        },
        "thesis": {
          "type": "string",
          "minLength": 1
        },
        "conclusion": {
          "type": "string",
          "minLength": 1
        },
        "evidenceIds": {
          "type": "array",
          "items": {
            "$ref": "#/definitions/id"
          },
          "uniqueItems": true
        }
      },
      "required": [
        "id",
        "thesis",
        "conclusion",
        "evidenceIds"
      ],
      "additionalProperties": false
    },
    "case": {
      "type": "object",
      "properties": {
        "verdictId": {
          "$ref": "#/definitions/id"
        },
        "modules": {
          "type": "array",
          "items": {
            "type": "object",
            "properties": {
              "id": {
                "$ref": "#/definitions/id"
              },
              "title": {
                "type": "string",
                "minLength": 1
              },
              "thesis": {
                "type": "string",
                "minLength": 1
              },
              "conclusion": {
                "type": "string",
                "minLength": 1
              },
              "recordIds": {
                "type": "array",
                "items": {
                  "$ref": "#/definitions/id"
                },
                "uniqueItems": true
              }
            },
            "required": [
              "id",
              "title",
              "thesis",
              "conclusion",
              "recordIds"
            ],
            "additionalProperties": false
          },
          "minItems": 4
        }
      },
      "required": [
        "verdictId",
        "modules"
      ],
      "additionalProperties": false
    }
  }
}
