{
  "meta": {
    "title": "公司研究：从起步资产到当前路线",
    "question": "LoopDesk 下一阶段扩大销售，还是先验证交付？",
    "asOf": "2026-09-28",
    "scope": "三个虚构公司；一个 90 天批次；展示一次问答之后的阶段性判断。",
    "notice": "全部内容为虚构教学数据，不代表真实经营事实。事实标签仅表示案例内的记录身份。",
    "verdictId": "c-overview",
    "keyMetricIds": [
      "c-retention",
      "c-commitment",
      "c-capacity"
    ]
  },
  "companies": [
    {
      "id": "loopdesk",
      "name": "LoopDesk",
      "period": "当前试验"
    },
    {
      "id": "servicebench",
      "name": "ServiceBench",
      "period": "早期路径",
      "case": {
        "verdictId": "c-case-verdict",
        "modules": [
          {
            "id": "case-assets",
            "title": "01 互补起点资产",
            "thesis": "客户信任和实施经验共同降低启动阻力。",
            "conclusion": "资产必须转为投入与交易，能联系客户不等于已有订单。",
            "recordIds": [
              "c-profile"
            ]
          },
          {
            "id": "case-validation",
            "title": "02 首次交易与交付验证",
            "thesis": "先看真实动作，再解释它为什么有用。",
            "conclusion": "从同系统服务到重复配置，再到第二实施者，后一步依赖前一步证据。",
            "recordIds": [
              "s-one",
              "s-two",
              "s-three"
            ]
          },
          {
            "id": "case-tradeoffs",
            "title": "03 取舍与反模式",
            "thesis": "有证据的取舍与研究者的建议分别标记。",
            "conclusion": "没有开放市场不证明曾经主动拒绝；不替历史补写动机。",
            "recordIds": [
              "c-tradeoff"
            ]
          },
          {
            "id": "case-engine",
            "title": "04 回路与迁移",
            "thesis": "逐条检验交付是否改善下一单成本与质量。",
            "conclusion": "当前可借鉴有限服务试验；复制与平台化仍需补证。",
            "recordIds": [
              "c-loop",
              "c-transfer"
            ]
          }
        ]
      }
    },
    {
      "id": "flowhub",
      "name": "FlowHub",
      "period": "不同资产对照"
    }
  ],
  "records": [
    {
      "id": "c-overview",
      "companyId": null,
      "section": "verdict",
      "kind": "inference",
      "role": "judgment",
      "status": "阶段性判断",
      "title": "先验证一个场景的交付，再决定扩张",
      "text": "已有付款与短期留存信号；收到补充回答后，当前验证从多个共同配置客户收窄为一个客户、一个系统和一个验收任务。",
      "limitation": "尚未验证客户业务成果、有效使用和第二实施者复制；全部为教学构造，不能用于真实经营判断。",
      "evidenceIds": [
        "e-case",
        "e-answer"
      ],
      "relatedIds": [
        "c-retention",
        "q-one",
        "a-one"
      ]
    },
    {
      "id": "c-retention",
      "companyId": "loopdesk",
      "section": "verdict",
      "kind": "fact",
      "role": "metric",
      "status": "案例给定",
      "title": "90 天客户留存",
      "text": "同一获客批次的 8 家付费客户中，6 家在 90 天时仍付费，无扩张或降级。",
      "limitation": "样本仅 8 家；不能外推年度续费，也不证明客户达到了业务成果。",
      "evidenceIds": [
        "e-case"
      ],
      "relatedIds": [
        "c-overview"
      ],
      "metric": {
        "value": "6 / 8",
        "unit": "家 · 75%",
        "basis": "同一批次；每家均已完成 90 天观察。"
      }
    },
    {
      "id": "c-assets",
      "companyId": "loopdesk",
      "section": "assets",
      "kind": "fact",
      "role": "asset",
      "status": "案例给定",
      "title": "现有关系、人员和工具能启动多大试验",
      "text": "当前可调用资产是老客户关系、已承诺的有限实施时间和内部脚本。",
      "limitation": "全部为教学构造，不代表真实公司；结论只在案例给定范围内成立。",
      "evidenceIds": [
        "e-case",
        "e-answer"
      ],
      "relatedIds": [
        "q-one",
        "c-route"
      ],
      "fields": [
        {
          "label": "客户关系",
          "value": "可联系三家老客户；新回答确认只有一家愿意付费试点。"
        },
        {
          "label": "人员承诺",
          "value": "两名实施工程师，未来六周每人每周十小时；不能追加更多工时。"
        },
        {
          "label": "产品资产",
          "value": "内部配置脚本，尚无外部伙伴交付标准。"
        },
        {
          "label": "资产缺口",
          "value": "没有广泛受众、渠道伙伴和已证明的跨团队复制。"
        }
      ]
    },
    {
      "id": "c-profile",
      "companyId": "servicebench",
      "section": "assets",
      "kind": "fact",
      "role": "profile",
      "status": "教学设定",
      "title": "对标档案：借现有客户启动",
      "text": "ServiceBench 为虚构对标；起点是三家老客户的付费意向及实施经验。",
      "limitation": "全部为教学构造，不代表真实公司；结论只在案例给定范围内成立。",
      "evidenceIds": [
        "e-case"
      ],
      "relatedIds": [
        "s-one",
        "s-two",
        "s-three",
        "c-transfer"
      ],
      "fields": [
        {
          "label": "起点资产",
          "value": "老客户信任与工程交付能力。"
        },
        {
          "label": "资产如何配合",
          "value": "创始人通过老客户关系组织需求确认，实施者用交付经验识别重复配置；意向转付款及具体投入仍逐项记录。",
          "kind": "inference"
        },
        {
          "label": "第一批用户",
          "value": "使用同类系统、有相同录入任务的三家老客户。"
        },
        {
          "label": "第一个产品",
          "value": "有明确范围的人工配置与复核服务。"
        },
        {
          "label": "第一种收入",
          "value": "按约定交付验收的服务费；未设定具体金额。"
        },
        {
          "label": "扩张依据",
          "value": "模板与第二位实施者的交付记录；后者仍需验证。"
        }
      ]
    },
    {
      "id": "c-alternative",
      "companyId": "flowhub",
      "section": "assets",
      "kind": "fact",
      "role": "profile",
      "status": "教学设定",
      "title": "另一种起点：集成伙伴自带客户",
      "text": "FlowHub 为虚构对照。已有集成伙伴及其客户，先用伙伴分发服务，再开放插件市场。",
      "limitation": "目标业务当前没有这类伙伴网络；相似功能不能证明资产相近。",
      "evidenceIds": [
        "e-case"
      ],
      "relatedIds": [
        "c-transfer"
      ],
      "fields": [
        {
          "label": "起点资产",
          "value": "伙伴网络与已有客户关系。"
        },
        {
          "label": "第一批用户",
          "value": "合作伙伴的既有客户。"
        },
        {
          "label": "第一个产品",
          "value": "伙伴可以交付的集成工具。"
        },
        {
          "label": "第一种收入",
          "value": "案例未设定金额与具体收费结构，保留未知。"
        }
      ]
    },
    {
      "id": "c-matrix",
      "companyId": null,
      "section": "paths",
      "kind": "inference",
      "role": "comparison",
      "status": "起点对照",
      "title": "冷启动资产横向对照",
      "text": "比较各自最初借用的资产，判断哪条路径接近当前条件。矩阵字段直接读取公司档案，同一信息只维护一次。",
      "limitation": "全部为教学构造。此全局矩阵保留两个对标；公司筛选只改变其余公司记录。",
      "evidenceIds": [
        "e-case"
      ],
      "relatedIds": [
        "c-profile",
        "c-alternative",
        "c-transfer"
      ],
      "comparisonIds": [
        "c-profile",
        "c-alternative"
      ]
    },
    {
      "id": "s-one",
      "companyId": "servicebench",
      "section": "paths",
      "kind": "fact",
      "role": "step",
      "status": "教学设定",
      "title": "01 老客户与共同任务",
      "text": "先从三家已存在信任关系的客户中确认同一系统、同一任务的需求。",
      "limitation": "全部为教学构造，不代表真实公司；结论只在案例给定范围内成立。",
      "evidenceIds": [
        "e-case"
      ],
      "relatedIds": [
        "s-two"
      ],
      "stage": "客户切入",
      "fields": [
        {
          "label": "动作事实",
          "value": "限定客户与系统范围，再安排交付。"
        },
        {
          "label": "机制判断",
          "value": "可能降低信任与适配成本；该解释未经过对照验证。",
          "kind": "inference"
        }
      ]
    },
    {
      "id": "s-two",
      "companyId": "servicebench",
      "section": "paths",
      "kind": "fact",
      "role": "step",
      "status": "教学设定",
      "title": "02 人工完成付费交付",
      "text": "先人工配置、复核并记录异常，再检查实际工时与客户验收。",
      "limitation": "全部为教学构造，不代表真实公司；结论只在案例给定范围内成立。",
      "evidenceIds": [
        "e-case"
      ],
      "relatedIds": [
        "s-three"
      ],
      "stage": "交易与交付验证",
      "fields": [
        {
          "label": "动作事实",
          "value": "服务费绑定约定的交付范围；记录重复配置步骤。"
        },
        {
          "label": "机制判断",
          "value": "用真实交易暴露购买与交付阻力。",
          "kind": "inference"
        }
      ]
    },
    {
      "id": "s-three",
      "companyId": "servicebench",
      "section": "paths",
      "kind": "inference",
      "role": "step",
      "status": "后续验证",
      "title": "03 模板化之后验证第二个人",
      "text": "把重复配置固化为模板，再让第二位实施者交付相同范围任务。",
      "limitation": "全部为教学构造，不代表真实公司；结论只在案例给定范围内成立。",
      "evidenceIds": [
        "e-case"
      ],
      "relatedIds": [
        "c-loop"
      ],
      "stage": "产品化与供给复制",
      "fields": [
        {
          "label": "需要观察",
          "value": "总实施与支持工时、验收质量、第二人独立交付程度。"
        },
        {
          "label": "机制判断",
          "value": "若模板降低下一单成本且保持结果，才支持复制。",
          "kind": "inference"
        }
      ]
    },
    {
      "id": "c-tradeoff",
      "companyId": "servicebench",
      "section": "paths",
      "kind": "inference",
      "role": "tradeoff",
      "status": "证据边界",
      "title": "取舍与反模式分开",
      "text": "不能从没看见某项功能，推导公司曾经主动拒绝它。",
      "limitation": "全部为教学构造，不代表真实公司；结论只在案例给定范围内成立。",
      "evidenceIds": [
        "e-case"
      ],
      "relatedIds": [],
      "fields": [
        {
          "label": "设定中的取舍",
          "value": "早期只服务同一系统，放弃其他定制需求。"
        },
        {
          "label": "研究者建议",
          "value": "模板未被第二人验证前，避免开放广泛交付承诺。"
        },
        {
          "label": "未知",
          "value": "没有设定公司是否讨论过开放市场；不补写动机。"
        }
      ]
    },
    {
      "id": "c-loop",
      "companyId": "servicebench",
      "section": "paths",
      "kind": "inference",
      "role": "loop",
      "status": "待验证",
      "title": "候选回路：客户交付如何反哺下一单",
      "text": "这是一个待验证回路；每条边都需要独立证据。",
      "limitation": "全部为教学构造，不代表真实公司；结论只在案例给定范围内成立。",
      "evidenceIds": [
        "e-case"
      ],
      "relatedIds": [],
      "edges": [
        {
          "from": "交付案例",
          "to": "配置模板",
          "mechanism": "从实际重复步骤中抽取模板。",
          "status": "教学设定：观察到重复步骤",
          "evidenceIds": [
            "e-case"
          ]
        },
        {
          "from": "配置模板",
          "to": "下一单交付",
          "mechanism": "尝试减少配置与复核工时，检查是否转移到支持成本。",
          "status": "假设：需验证成本与质量",
          "evidenceIds": [
            "e-case"
          ]
        },
        {
          "from": "下一单交付",
          "to": "交付案例",
          "mechanism": "新客户验收与异常记录继续补充模板知识。",
          "status": "假设：下一周期尚未观察",
          "evidenceIds": [
            "e-case"
          ]
        }
      ]
    },
    {
      "id": "c-transfer",
      "companyId": null,
      "section": "choices",
      "kind": "recommendation",
      "role": "transfer",
      "status": "带条件采用",